{
  "schema_version": "2.1",
  "plan_id": "lina-no-debt",
  "tenant_id": "personal-demo",
  "workspace_kind": "personal",
  "purpose": "no_debt_plan",
  "execution_mode": "proposal_only",
  "horizon": {
    "steps": 30,
    "unit": "day"
  },
  "data_quality": "declared",
  "proposed_actions": [
    {
      "type": "own_funds_transfer",
      "source_account_ref": "savings-demo",
      "destination_account_ref": "current-demo",
      "asset_id": "fiat:EUR",
      "amount_decimal": "230.00"
    }
  ],
  "evidence_refs": [
    "lina-fixture-v1"
  ]
}